<?xml version="1.0" encoding="UTF-8"?>
<?xml-stylesheet type="text/xsl" href="../print.xsl" ?>
<?xml-stylesheet type="text/css" href="../rules.css" 
title="Easy editing stylesheet" ?>
<!--
Chinese Grammar and Typo Rules for LanguageTool
Copyright (C) 2011-2012 Tao Lin
$Id: grammar.xml,v 1.0 2011-07-29 13:20:25 taolin2011 Exp $
-->
<rules lang="en" xsi:noNamespaceSchemaLocation="../rules.xsd"
  xmlns:xsi="http://www.w3.org/2001/XMLSchema-instance" xmlns:xs="http://www.w3.org/2001/XMLSchema">
  <category name="句法">
    <rulegroup id="s34" name="与中心语搭配不当">
      <rule>
        <pattern mark_to="-1">
          <token skip="-1">许多</token>
          <token>景象</token>
        </pattern>
        <message> ‘景象’不应该与‘（许）多’搭配，您可以使用‘<suggestion>一派</suggestion>’与之搭配。 </message>
        <short>与中心语搭配不当</short>
        <example type="incorrect" correction="一派"> 村里出现了<marker>许多</marker>欣欣向荣的景象。 </example>
        <example type="correct"> 村里出现了<marker>一派</marker>欣欣向荣的景象。 </example>
      </rule>
      <rule>
        <pattern mark_to="-1">
          <token skip="-1">杰出</token>
          <token>意义</token>
        </pattern>
        <message> ‘意义’不应该与‘杰出’搭配，您可以使用‘<suggestion>重大</suggestion>’与之搭配。 </message>
        <short>与中心语搭配不当</short>
        <example type="incorrect" correction="重大"> 《女神》具有<marker>杰出</marker>的历史意义。 </example>
        <example type="correct"> 《女神》是五四运动的产物，具有<marker>重大</marker>的历史意义。 </example>
      </rule>
      <rule>
        <pattern mark_from="1">
          <token skip="-1">照顾</token>
          <token>周全</token>
        </pattern>
        <message> ‘照顾’不应该与‘周全’搭配，您可以使用‘<suggestion>好</suggestion>’与之搭配。 </message>
        <short>与中心语搭配不当</short>
        <example type="incorrect" correction="好"> 上次我对你照顾得太不<marker>周全</marker>。 </example>
        <example type="correct">一定要照顾好妇女和儿童。</example>
      </rule>
    </rulegroup>
    <rulegroup id="s5" name="歧义">
      <rule>
        <pattern>
          <token skip="-1">超过</token>
          <token skip="-1" postag="u">的</token>
          <token regexp="yes" postag="m|q" postag_regexp="yes">百分之.*|倍</token>
        </pattern>
        <message>‘超过’造成的歧义。</message>
        <short>歧义</short>
        <example type="incorrect"> 实际生产的量<marker>超过了计划的百分之百</marker>。 </example>
        <example type="correct">实际产量远远超过了计划产量。</example>
      </rule>
      <rule>
        <pattern>
          <token postag="m"/>
          <token postag="q"/>
          <token postag="n"/>
          <token>、</token>
        </pattern>
        <message>数量词修饰并列短语，可能产生歧义</message>
        <short>语法错误</short>
        <example type="incorrect">
          <marker>3个领导、</marker>书记 </example>
        <example type="correct">3个市长来到了我们县。</example>
      </rule>
      <rule>
        <pattern mark_to="-1">
          <token postag="m"/>
          <token postag="q"/>
          <token postag="n"/>
          <token postag="c" regexp="yes" skip="5"> [和与及同跟既]<exception postag="m|q"
              postag_regexp="yes" scope="next"/>
          </token>
          <token postag="n">
            <exception postag="v|p" postag_regexp="yes" scope="previous"/>
          </token>
          <token postag="n.*|vn|q" postag_regexp="yes" negate_pos="yes"/>
        </pattern>
        <message>数量词修饰并列短语，可能产生歧义</message>
        <short>语法错误</short>
        <example type="incorrect">
          <marker>3个领导和书记</marker>莅临视察。 </example>
        <example type="correct">3个市长和3个书记莅临我校指导工作。</example>
      </rule>
    </rulegroup>
  </category>
</rules>
